year,to_country_id,to_country,performer,song,place_contest,running_final,place_final,points_final,points_tele_final,points_jury_final,composers,lyricists,lyrics,youtube_url
2020,fi,Finland,Aksel Kankaanranta,Looking Back,,,,,,,,,"We would fall asleep\nTalking 'bout our dreams\nWaiting for eighteen\nIs never what it seems\n\nWe were young and naive\nDidn't know what we need\nWe were in such a rush to grow up\n\nWe were restless, confused\nSummer nights on the roof\nDidn't know what was in front of us\n\nChasing the high life\nStuck in the low lights\nBut we never know what we have\nUntil it's over and we're looking back\n\nSpeeding through red lights\nWe had a good ride\nBut we never know what we have\nUntil it's over and we're looking back\n\nAll these memories \nMade me feel at home\nWhen I walk these streets\nI'm the only one, I know \n\nWe were young and naive\nDidn't know what we need\nWe we're in such a rush to grow up\n\nNow it's too late to save \nAll the seasons have changed \nDidn't know what was in front of us\n\nChasing the high life\nStuck in the low lights\nBut we never know what we have\nUntil it's over and we're looking back\n\nSpeeding through red lights\nWe had a good ride\nBut we never know what we have\nUntil it's over and we're looking back\n\nChasing the high life\nStuck in the low lights\nBut we never know what we have\nUntil it's over and we're looking back\n\nSpeeding through red lights\nWe had a good ride\nBut we never know what we have\nUntil it's over and we're looking back\n\nYeah we never know what we have\nUntil it's over and we're looking back",https://youtube.com/watch?v=EgONBKFQpxE
2020,ge,Georgia,Tornike Kipiani,Take Me As I Am,,,,,,,,,"How do you want me to talk like an Englishman?\nWhere do you want me to dress like an Italian?\nNow do you want me to dance like a Spanish guy?\nI guess you don't love me\nNo, you don't love me\n\nHow do you want me to talk like an Englishman?\nWhere do you want me to dress like an Italian?\nNow do you want me to dance like a Spanish guy?\nI guess you don't love me\nNo, you don't love me\n\nI love you, ti amo, te quiero\nTake me as I am\nBut you don't love me\nWhy don't you love me?\n\nSo tell me why do you want me to smell like a French homme?\nOh, tell me why do you want me to play like a German?\nWhy don't you want me to be just the way I am?\nI guess you don't love me\nWhy don't you love me?\n\nJe t'aime, ich liebe dich\nBut you don't love me\nWhy don't you love me?\nI love you, I love you",https://youtube.com/watch?v=LjNK4Xywjc4
2020,lv,Latvia,Samanta Tīna,Still Breathing,,,,,,,,,"I will keep on going\nI will keep on running\nRunning till I reach the end\nStrong enough to take it\nI am gonna make it\nDestiny is in my hands\n\nThought I'd never get up\nThought I'm gonna give up\nLost in my way\nMany time between\n\nBut I'm still breathing\nI'm still breathing\nNothing to regret\nNever looking back\n\nI will keep on going\nI will keep on running\nRunning till I reach the end\nStrong enough to take it\nI am gonna make it\nDestiny is in my hands\n\nLife, life's go on (Let the life go on)\nI grow strong (So can I get strong)\nLife, life's go on (Let the life go on)\nBut I grow strong\n\nEvery day I wake up\nTrying to get higher\nBe a better woman\nWorking even harder\n\nI'm still breathing\nI'm still breathing\nListening to my heart\nReady for the start\n\nI will keep on going\nI will keep on running\nRunning till I reach the end\nStrong enough to take it\nI am gonna make it\nDestiny is in my hands\n\nLife, life's go on (Let the life go on)\nI grow strong (So can I get strong)\nLife, life's go on (Let the life go on)\nBut I grow strong\n\nReaching for the stars\nI'm knowing getting closer\nLife is music\nI am a composer\nMy dreams become so real with\nAll the love I'm feeling\n\nI'm still breathing\nI'm still breathing\n\nI will keep on going\nI will keep on running\nRunning till I reach the end\nI will keep on going\nI will keep on running\nRunning till I reach the end\nLife, life\n\nI will keep on going\nI will keep on running\nRunning till I reach the end\nStrong enough to take it\nI am gonna make it\nDestiny is in my hands",https://youtube.com/watch?v=ELr6U2fOrnE
2020,pt,Portugal,Elisa,Medo de sentir,,,,,,,,,"Qual é a saída\nEu acho que já não sei amar\nE se o amor me convida\nAgora não consigo aceitar\nParece que é rotina\nA minha solidão teima em voltar\n\nEu não era assim\nMas agora tenho medo de sentir\nPergunta ao tempo ele sabe tudo sobre mim\nPergunta ao tempo ele sabe tudo sobre mim\n\nSe me dás a tua mão\nEu não sei como vou reagir\nSe falas de coração\nParece que estou outra vez a ouvir\nMais uma ilusão\nQue não tarda muito em partir\n\nEu não era assim\nMas agora tenho medo de sentir\nPergunta ao tempo ele sabe tudo sobre mim\nPergunta ao tempo ele sabe tudo sobre mim\nO que ele guarda, diz tudo o que eu sinto por ti\n\nEu já tentei mudar\nMas a vida levou\nO melhor que eu tinha em mim\nE se um dia eu voltar\nEsperarás por mim?\n\nEu não era assim\nMas agora tenho medo de sentir\nPergunta ao tempo ele sabe tudo sobre mim\nPergunta ao tempo ele sabe tudo sobre mim\nO que ele guarda, diz tudo o que eu sinto por ti",https://youtube.com/watch?v=eIZ48w4epng
2020,ch,Switzerland,Gjon's Tears,Répondez-moi,,,,,,,,,Pourquoi la pluie\nEt les nuages aussi\nEt les nuages aussi\nPourquoi le soir\nTu t'endors dans mon lit\nTu t'endors dans mon lit\nPourquoi on dort\nSi loin de la famille\nDans un autre pays\nPourquoi la mort\nVient après la vie\nVient après la vie\n\nJ'donne ma langue au chat\nRépondez-moi\nPas de langue de bois\nRépondez-moi\n\nPourquoi on court\nSans jamais s'arrêter\nSans jamais s'arrêter\nPourquoi on prie\nChacun de son côté\nChacun de son côté\nPourquoi je suis\nIci étranger\nLà-bas étranger\nPourquoi mon fils\nGrandira sans été\nGrandira sans été\n\nJ'donne ma langue au chat\nRépondez-moi\nPas de langue de bois\nRépondez-moi\n\nJ'donne ma langue au chat\nRépondez...\n\nJ'donne ma langue au chat\nRépondez-moi\nPas de langue de bois\nRépondez-moi,https://youtube.com/watch?v=O9GAfFHZE-E
